body,title
"

Estimados Votantes Indecisos: Desde hace más de 2 años, nunca les he dicho lo que tienen que hacer.

Me queda claro que son muy inteligentes para tomar sus propias decisiones. Pero esta semana, voy hacer una excepción.

Les voy a pedir que, en las próximas elecciones de junio del 2021, no se les ocurra votar por las basuras de Morena, que no es ni partido ni moreno ni güero, El Partido del Trabajo, que ni es partido y que menos trabaja, y el disque partido Verde, que ni es verde ni es ecologista.

Y tengo mis razones del porqué pedirles este favor: en primer lugar, porque nosotros, el pueblo, les valemos ABSOLUTAMENTE MADRES.

A los diputados de Morena, no les importa nuestro bienestar. A ellos lo único que les interesa es el PODER Y LA LANA.

En segundo lugar, porque comparados con el PRI, estos son por mucho, MÁS AMATEURS Y MÁS BURROS. Pero ¡mucho más!

Les explico el porqué: porque estos diputados de quinta, NO SABEN LEGISLAR. Ellos —por ser mayoría— están exclusivamente para cumplir los caprichos y las idioteces que se le ocurran a Su Majestad el Rey.

Y como ejemplo, les platico que la Suprema Corte declaró INCONSTITUCIONAL el juicio a los expresidentes.

Eso no será un obstáculo para nuestro admirado monarca. Nuestro Rey, va a presentar una iniciativa de Ley para que estos zánganos de quinta la aprueben y se vuelva legal lo ilegal.

¿Ya me entienden por qué estas basuras no pueden ser mayoría? Porque quebrantan cualquier ética y cualquier ley para cumplir los caprichos de Su Excelencia. No para legislar.

Y como tienen mayoría, literalmente hacen lo que quieren.

Y si no me creen, ahí está su líder de quinta Mario Delgado, que es el primero en abandonar el barco para presidir su partidito en las próximas elecciones.

¿Y por qué va abandonar a los burros? ¡Pos muy fácil! Tener más poder, más lana y más fama. Los va abandonar cuando deje planchado el último capricho de nuestro emperador que es destruir todos los fideicomisos para que su majestad disponga de esos 65 mil millones de pesos para hacer lo que se le dé su regalada gana. Y mientras tanto, el sector más marginado…. que se siga jodiendo.

Cambiemos de tema:

Su Excelencia dice que ya cumplió 95 de sus 100 promesas de campaña. ¿Les platico algunas de sus promesas? Ahí les va:

Se mantendrán las Estancias Infantiles. MINTIÓ.

En 2019 habrá 100 universidades públicas. MINTIÓ.

Se hará realidad el derecho a la salud. El propósito es garantizar a los mexicanos atención y medicinas gratuitas. MINTIÓ.

2 millones trescientos mil jóvenes serán contratados para trabajar como aprendices con un sueldo de $ 3,600 mensuales. MINTIÓ no llevan ni doscientos mil.

Se fomentará la actividad pesquera. MINTIÓ.

No habrá gasolinazos. Jajaja VOLVIÓ A MENTIR.

No se aumentará la deuda pública. MINTIÓ. Ya pidió préstamos por $5 mil millones de dólares a diferentes fondos y bancos en el mundo.

Tengo espacio para una más: Se tratará con amabilidad a los ciudadanos en las oficinas públicas y en cualquier lugar. MINTIÓ.

Y, para terminar, me acaba de llegar a la cabeza una imposible posibilidad, pero posible: ¿Y si a nuestro Rey se le ocurriera —digamos— en el 2023 reelegirse sin elecciones con el apoyo de la mayoría de los zánganos de Morena?

¿Sí me entienden verdad? POR FAVOR: ¡NO VAYAN A VOTAR POR MORENA!
",
"
La diferencia de edad con su esposa y el hecho de que sus dos hijos son adoptados, han alimentado durante años las versiones sobre una supuesta homosexualidad del actor Hugh Jackman, de 51 años, el intérprete de Wolverine en la saga ""X-Men"" de Marvel.
Y esta semana Deborra-Lee Furness, de 64 años, su mujer, se refirió al tema en una entrevista en el programa ""Anh's Brush with Fame"" de ABC TV & iview, respondiendo y también lanzando una crítica a las especulaciones.
Lee también: Hugh Jackman celebra a ""Logan"" con imágenes inéditas de Wolverine 
""Veo estas revistas y son tan mezquinas... Espero que la gente se dé cuenta de que todo está inventado"", contestó cuando el artista Anh Do le preguntó sobre los rumores. Luego bromeó diciendo que su marido ""ha sido gay durante tantos años, yo también era gay cuando hice 'Shame'. Todos estaban impactados cuando me casé"".
En tono más serio, agregó: ""Simplemente está mal. Es como si alguien dijera sobre Elton John 'oh, él es heterosexual'. Estoy segura que estaría muy molesto"".
También lee: Ryan Reynolds ""echa a perder"" reunión de X-Men de Hugh Jackman 
Hugh Jackman y su esposa Deborra-Lee Furness. Foto: Archivo AP 

Según recordó TMZ, la pareja se conoció en 1995 cuando ambos trabajaban en una serie de televisión australiana y se casaron un año después. En 2013, Jackman se refirió a los rumores sobre su supuesta homosexualidad y reconoció que afectaban a su esposa.

 



 


 

 



 




Ver esta publicación en Instagram


 



 

 

 



 

 



 

 

 



2002

Una publicación compartida de  Hugh Jackman (@thehughjackman) el 2 Jul, 2020 a las 4:57 PDT




En 2018, señaló a una estación de radio estadounidense que las especulaciones probablemente comenzaron en 2003 cuando en el musical de Broadway ""The Boy from Oz"" interpretó al cantautor gay Peter Allen y besó en la boca a su coprotagonista sobre el escenario.

rad 
 
",
"
Morelia.- La Fiscalía de Michoacán presentó ante un juez a Diego Urik N, presunto asesino de la joven de 21 años de edad, Jessica González Villaseñor; al inculpado le imputan el delito de feminicidio, ocurrido en la ciudad de Morelia.
La audiencia se lleva a cabo en un juzgado de oralidad del Poder Judicial del estado, ubicado a las afueras de la ciudad de Morelia.
De acuerdo a los familiares de la víctima, este mismo jueves puede ser vinculado o no a proceso el inculpado, a solicitud de la misma defensa de Diego Urik.
Es decir que la defensa no solicitará la ampliación del término constitucional como se lo ha hecho saber al juez de la causa.
En estos momentos se ha declarado un receso en la audiencia, en la cual la Fiscalía relató que Diego Urik abusó también sexualmente de Jessica, para después matarla.
El Registro Nacional de Detenciones reveló que Diego Urik N, presunto homicida de la joven Jessica González Villaseñor, fue detenido en el municipio de Cihuatlán, Jalisco.
El RND infirmó que la captura del probable feminicida se realizó a las 4:30 de la tarde de ayer miércoles, sobre la calle Morelos, de la colonia Barra de Navidad.
Los datos de la ficha refieren que fue la Policía Ministerial quien detuvo al presunto homicida, afuera de un conocido hotel de esa localidad del estado de Jalisco.
 

Búsqueda y localización de Jessica

El pasado 21 de septiembre, Jessica González Villaseñor salió cerca de las 17:00 horas de su casa en la ciudad de Morelia y su familia no la volvió a ver con vida.
Un día después, sus familiares presentaron su denuncia ante la Fiscalía General de Justicia de Michoacán.
A partir de ese momento, los familiares y amigos iniciaron sus acciones de búsqueda y movilizaciones a las que se sumó la población y colectivos feministas.
El miércoles 23, las calles de Morelia se inundaron de ciudadanos, familiares y amigos de Jessica, que exigían la pronta aparición de la licenciada en Educación. Lo mismo drurante dos días después, siendo el viernes el día en que se supo que el cuerpo de Jessica había sido encontrado.
La Fiscalía de Michoacán informó que el cuerpo de la joven mujer había sido encontrado en una zona boscosa ubicada a las afueras de la ciudad de Morelia.
Ya para ese momento se había revelado que la última persona con la que había estado Jessica era con Diego Urik, un estudiante del Tecnológico de Monterrey.



Los testimonios, videos y ubicaciones señalaban que Hanna, la novia de Diego, había llevado esos días un vehículo a lavar a un lugar de la zona de Santa María.
Más tarde, Diego Urik había regresado en otro vehículo y exigido que lavaran a detalle el automóvil que había dejado Hanna.
El joven de 18 años de edad no regresó por el auto y no se volvió a saber de él.
Fue señalado como presunto homicida por la familia y por la misma FGE, por lo cual, desde el momento de la muerte de Jessica, fue declarado prófugo de la justicia.
Luego de que la a Fiscalía dio a conocer que un juez ya había concedido una orden de aprehensión en contra de Diego Urik, el trámite ante el Instituto Nacional de Migración la Alerta Migratoria para su captura, se hizo la petición respectiva ante la Dirección General de Asuntos Policiales Internacionales e Interpol, para la emisión de la Ficha Roja, para su búsqueda, localización y presentación ante el órgano jurisdiccional.
Este miércoles, el fiscal estatal Adrián López Solís informó que Diego Urik había sido capturado y que la FGE ya realizaba los trámites para presentarlo ante un juez.
om/fml

 
",
"
Este miércoles, Diego Urik, de 18 años, fue detenido en un hotel en Jalisco, por su presunta responsabilidad en el feminicidio de Jessica González Villaseñor. 
Urik, según informó el fiscal de Michoacán, Adrián López Solis, fue aprehendido en el municipio de Cihuatlán, en el estado de Jalisco. 
Posteriorimente fue trasladado a Morelia, en donde permanece en un penal de mediana seguridad. 
En un video compartido en el noticiero de Ciro Gómez Leyva, aparece el joven momentos después de su captura en Jalisco. 
También lee: Diego Urik, presunto feminicida de Jessica, fue detenido en esta calle, fuera de un hotel en Jalisco
 



Mexican authorities arrest Diego Mañón, the man who allegedly murdered Jessica González 








El clip muestra que Diego fue detenido con el cabello aparentemente más corto, que al de las imágenes difundidas en redes sociales en las que se pedía la cooperación para su captura. También, en el video de su detención se muestra que porta una playera blanca, shorts café y una gorra de igual color. 
 

Así detuvieron en un hotel de Cihuatlán #Jalisco, al presunto feminicida de #JessicaGonzález. El joven de 18 años, identificado como Diego Urik, fue trasladado a un penal en #Morelia pic.twitter.com/FBn3S0VVe1
 — Ciro Gómez Leyva (@CiroGomezL) October 1, 2020

Apenas el martes la Fiscalía de Michoacán ofreció una recompensa de un millón de pesos para quien diera información que ayudara a la detención del presunto feminicida, esto luego de que se encontrara el cuerpo sin vida de su exnovia, Jessica González, el pasado 25 de septiembre. 
También lee: Lo que sabemos del caso Jessica y por qué se señala a Diego como presunto feminicida
Jessica, licenciada en educación, presentaba golpes en la cabeza, las cuales le provocaron una hemorragia y eventualmente le causaron la muerte.
Por su parte, y según con el Registro Nacional de Detenciones del gobierno federal, la captura del probable feminicida se realizó a las 4:30 de la tarde de este miércoles, sobre la calle Morelos, de la colonia Barra de Navidad, a las afueras de un hotel de la localidad.

jabf
 
",
"
Pasar mucho tiempo frente a tu computadora puede que sea un requisito para que completes tus rutinas de trabajo o escuela, si no es que la utilizas para entretenerte en diferentes plataformas como videojuegos o series de televisión, sin embargo, es importante que conozcas los posibles efectos que podrías notar en tu cuerpo al utilizar esta herramienta tecnológica diario y por largas jornadas. 
En la actualidad, es vital pasar mucho tiempo frente a las pantallas, por ello, es indispensable que consideres las horas que asignas para estas tareas, debido a que podrían estar afectando tu calidad de vida sin que te des cuenta. 
Si quieres conocer qué le sucede a tu cuerpo por estar frente a tu computadora por mucho tiempo, en Techbit te compartiremos todos los detalles. 
Leer también: Conoce los lentes inteligentes que no te permiten que te distraigas


Problemas de la visión 
De acuerdo con un artículo de la Escuela de Medicina de Harvard, pasar demasiado tiempo frente a la computadora podría afectar tu vista, esto es debido a que durante tu trabajo, el uso de videojuegos o incluso estar viendo tu serie favorita podrías olvidar parpadear. 
El término general de esta consecuencia en la salud es “Síndrome de visión por computadora” y entre sus síntomas está la presencia de sequedad en los ojos y la fatiga visual, los cuales son provocados por no parpadear para restablecer la película lagrimal de los ojos. 
Según Harvard, se requiere parpadear por lo menos 15 veces por minuto para evitar problemas a futuro, asimismo, recomiendan ajustar el brillo de tu pantalla y ajustar la altura donde se encuentra tu monitor, lo ideal es que se encuentra un poco más abajo del nivel de los ojos para evitar daños en la vista. 
La fatiga visual también podría causarte dolores de cabeza continuos, para evitarlos, Harvard aconseja el uso de gafas de descanso, así como gotas para lubricar los ojos. Recuerda que también es necesario medir los tiempos que pasas frente a tu celular y computadora para no abusar de tu vista. 
 (Foto: Unsplash)


Afecta tu sueño 
Según la información respalda por Harvard, pasar mucho tiempo frente a la computadora también puede alterar el sueño, es decir, será más complicado para ti conciliar el sueño debido a que la luz de la pantalla de tu ordenador estimula el cerebro para que esté más tiempo activo, esto es posible porque la luz azul de tus dispositivos provocan la disminución de melatonina, hormona que promueve el sueño. 
Leer también: Cómo escaparte de una reunión en zoom sin ser descubierto


Lesiones en el cuerpo 
El sitio en inglés Better Health afirma que se pueden presentar dolores de espalda y cuello relacionados con el uso constante de la computadora, este tipo de lesiones pueden ser causados por un mal diseño en tu estación de trabajo o por utilizar posturas incorrectas durante largos periodos. 
Aunque se puede pensar que permanecer sentado supone menor fuerza física, el artículo de Better Health describe que esta postura sí provoca cansancio físico debido a que las extremidades permanecen firmes y se reduce la circulación de la sangre hacia los músculos, tendones y ligamentos, lo cual podría provocar rigidez y dolor.  


Adicción a la pantalla
Un artículo del sitio especializado Rally Health explica que pasar mucho tiempo frente a la computadora como mero entretenimiento podría causar la sensación de recompensa o placer, resultado de la producción de dopamina en el cerebro. 
El mismo texto ejemplifica que jugar videojuegos en la computadora enciende las regiones cerebrales de manera similar como lo hace el consumo de drogas o mientras estás  apostando en los juegos de azar. Este efecto también puede aparecer al pasar mucho tiempo en redes sociales al esperar las reacciones hacia alguna publicación que realices. 
Leer también: ¡No toques nada! Conoce el nuevo sistema de pago sin contacto


Inactividad y tu cuerpo
Información de la Biblioteca Nacional de Medicina de los Estados Unidos señala que una vida llena de sedentarismo podría afectar tu cuerpo de manera importante, ya que actualmente el estilo de vida de muchos se trata de permanecer sentado durante sus horas laborales y después llegar a casa y permanecer sentado o acostado viendo televisión o tu computadora. 
Todo este tipo de actividades son las causantes de una quema menor de calorías, lo cual aumenta tu peso corporal, por otro lado también te haría perder movilidad al mantenerse en la misma posición durante mucho tiempo, los huesos podrían debilitarse al perder minerales, el metabolismo se hace más lento a causa del sedentarismo por lo que la acumulación de grasas y azúcares podría afectarte a largo plazo. 
Entre otros problemas está la posibilidad de tener una mala circulación, una baja considerable en el sistema inmunológico, la presencia de inflamación en distintas partes del cuerpo como piernas, pies y brazos, incluso un desequilibrio hormonal. 
Es importante reconocer estos aspectos del cuerpo humano, ya que la información de la Biblioteca Nacional de Medicina de los Estados Unidos apunta que se pueden desarrollar enfermedades como la hipertensión, diabetes, enfermedades cardíacas, síndrome metabólico, colesterol alto, cáncer, osteoporosis, depresión y ansiedad.
 (Foto: Unsplash)
",
"

Tiene 35 años, dedicado desde hace una década a mejorar las políticas públicas, recibió una llamada en la que le informaron que su nombre y teléfono aparecían en un periódico de circulación local en Yucatán. Pidió que le enviaran una fotografía. Minutos después notó que eran varios medios los que lo mencionan en una larga lista de exfuncionarios espiados en el sexenio de Miguel Ángel Mancera.

“Sentí frío en la espalda, mi estómago se hundía con náuseas al imaginar a estos tipos mirando mis fotos, revisando mis mensajes, teniendo acceso a todo lo que sólo corresponde a mi intimidad. No me preocupé nada por el tema público, durante mi desempeño como funcionario siempre fui transparente, congruente. Lo que me enfureció, fue saber que mi vida personal podía ser usada con fines políticos”. Me comenta el ex servidor de la CDMX.

Otra exfuncionaria me narró que desde que colaboraba en el gobierno, ella y otros compañeros intuían que estaban siendo espiados porque las llamadas telefónicas eran interrumpidas y en ocasiones algunos autos los seguían, incluso fuera del contexto laboral. Las amenazas eran veladas. En una ocasión, al cuestionar sobre una reasignación de recursos inexplicable, el señor Pedro Arellano le respondió “con esa panza de 8 meses de embarazo, no tienes miedo de que te pase algo?”

Mexicanos contra la Corrupción reveló un aparato de espionaje que operaba en el gobierno de Mancera coordinado, según su informe, por el entonces secretario de Gobierno y actual diputado federal por el PT Héctor Serrano Cortés. De confirmarse ¿quiénes más estarían implicados en esta operación de “inteligencia”? Son un grupo unido y con fuerza política, todavía latente. Un excolaborador cercano a Serrano me contó que este grupo trabajaba con una especie de “fichaje” en la que seleccionaban a quienes intervenían basándose en su perfil de opositores. “Para darnos una idea de los incentivos de sus lazos, te podría contar que Mauricio Toledo (actual diputado federal por el PT) conocido entre el grupo como El Tomate, siempre fue considerado el joven promesa del PRD”. Otro personaje relevante era Leonel Luna, quien fungía como jefe delegacional de Álvaro Obregón. No era extraño que llamaran a un secretario del gobierno para mostrarle la sábana de sus llamadas, el acto amedrentaba por sí solo”.

La entonces secretaria de Gobierno Patricia Mercado, que también fue víctima de espionaje, aclaró que no tenía conocimiento de que sus excompañeros estuvieran interviniendo sus conversaciones y las de sus allegados.

Entre otras víctimas aparecen el hijo del presidente Andrés Manuel López Obrador, Claudia Sheinbaum y Ricardo Monreal. ¿Presentarán denuncia o seguirán acordando con quienes violaron su derecho a la privacidad?

Al día de hoy, la Fiscalía General de la República no ha resuelto prácticamente nada sobre el caso Pegasus, software que se utilizó para espiar a periodistas y defensores de derechos humanos. Cabe preguntar: si la FGR no ha dado resultados en el caso Pegasus, ¿qué podemos esperar de la Fiscalía de la CDMX que tiene menos recursos?

¿Ser espiado se compensa con nuevos acuerdos de intercambio por reformas, destrucción de fideicomisos, alianzas electorales, etc? Veremos si Morena opta por la distancia con quienes violaron el derecho a la privacidad de sus líderes o continúan aliándose con ellos. Por lo pronto, Héctor Serrano permanece en silencio.

Twitter: @maiteazuela
",
" 10 % PULSO SOCIAL3 Los tríos sexuales han sido un tabú, incluso en las pláticas de sexo, por lo cual en el cine o la literatura es común que no se presenten tan a menudo, por ello es que este conteo retrata a las parejas que han añadido un integrante más y el resultado, en la mayoría de los casos, ha sido altamente erótico.
El cine siempre ha sido, en mayor o menor medida, un escaparate del sexo, y muchas películas se han ganado fama a base de “escenas subidas de tono”.
Una de las barreras más duras de derribar ha sido la de los tríos, escenas a tres bandas que parecen ser prejuicio, pero que poco a poco han logrado hacerse un hueco en películas comerciales.
Por ello en De10.mx tenemos un recuento de estas cintas que nos dejan sin aliento por los momentos candentes de los que gozan tres personas al mismo tiempo...
1. Y tu mamá también (2001)
Ahora son mundialmente famosos, pero hace unos años cuando comenzaban a despuntar Gael García Bernal y Diego Luna se atrevieron a más. La cinta del compatriota Alfonso Cuarón contó con la presencia de la sensual Maribel Verdú. La historia narra a dos jóvenes que despiertan al mundo ante los ojos de una mujer que esconde más que su cuerpo, un alma llena de secretos.

Video of sfrqmjp7hyk


2. Threesome (Tres formas de amar, 1994)
Esta película dirigida por Andrew Fleming es explícita desde el nombre. Lara Flynn Boyle es la actriz que acaba compartiendo por error la habitación del campus universitario con dos chicos: Stephen Baldwin y Josh Charles. En un momento de lujuria, pasó lo que creías que pasaría y vaya que valió la pena.

Video of R1kw45ZH5vQ


3. The dreamers (Soñadores, 2003)
Bernardo Bertolucci es experto en despertar controversia y aquí lo hizo de nuevo: jóvenes, casi adolescentes, y además hermanos (Eva Green y Louis Garrel), dan rienda suelta a su imaginación sexual durante las vacaciones de sus padres. El tercero en discordia es un estudiante norteamericano, interpretado por Michael Pitt, que no se quiere quedar atrás…

Video of xrmaW1yO4lc


4. Wild Things (Criaturas salvajes, 1998)
Uno de los grandes iconos del cine de los 90. los protagonistas eran Matt Dillon, Neve Campbell y Denise Richards. Las dos encarnan el prototipo de chica mala, y aunque realmente la escena más morbosa de la película tiene lugar en la piscina y es lésbica, las incursiones de Dillon hacen que la temperatura aumente.  

Video of WflcXBYEN8M


5. Vicky Cristina Barcelona (2008)
Más estrellas en acción, con el morbo añadido de que dos son españolas y además pareja en la vida real… y la tercera es ni más ni menos que Scarlett Johansson, es seguramente el trío más hot de todos los tiempos. Primero eran celos, luego amistad y uno ya no sabe cómo terminará.
¡Confirmado! Disney pospone estreno de “Black Widow” y otras películas

Video of ZAbHdshJNCE


6. Shortbus (2006)
Más que un simple trío, John Cameron Mitchell elige la dirección de una orgía en la que se puede distinguir desde parejas gay, tríos y cuartetos, hasta una autofelación, explorando el sexo de todas las formas posibles para demostrar las personas no son blancas ni negras, son eróticas.  

Video of WSvrb9h2huc


7. Savages (Salvajes, 2012)
Más que un trío, la cinta gira entorno a una relación de pareja que se deshace entre el amor y la amistad de tres personas, dos chicos y la flamante Blake Lively, los momentos de la cinta de Oliver Stone causó gran polémica por los temas de los que hablaba.  

Video of xXNxKwAKGpw


8. Ken Park (2002)
Es un film franco-holandés-estadounidense llevado a las pantallas el 16 de mayo del 2003, el cual narra la historia de un grupo de cuatro adolescentes en California, donde harán hasta lo imposible para satisfacer cada uno de sus deseos carnales, incluido un trío sexual. En este proyecto de los directores Larry Clark y Edward Lachman.

Video of cGO0pyh5tqw


9. Summer lovers (Un amor de verano, 1982)
Es la primer película en presentarnos un trío sexual, que no sólo resulta deseable también cuenta con las hermosas rubias (Daryl Hannah y Valerie Queennessen) que Peter Gallagher logra tener en sus brazos, la producción estadounidense de 1982 fue grabada en Grecia.

Video of 0Nihge5xeJM


10. Machete (2010)
El héroe de la película Danny Trejo participa en un trio con Lindsay Lohan, quien interpreta a la hija de un político y la madre de Lindsay, Dina Lohan, apareciendo en una alberca junto al actor completamente desnudas para darle el toque sensual a la cinta.  

Video of D4iBoloz18Y


Fuentes: encapsulados.tv, nosotras.com
¿Qué otro trío erótico recuerdas en el cine? 
VIDEO:

",
