body,title
"
En los siguientes dos días confluyen en el Poder Judicial de la Federación dos asuntos sobre los que deberán pronunciarse ministros y magistrados electorales, cuyas decisiones mayoritarias tendrán un impacto indiscutible en la vida política y democrática del país. Por un lado, en la Suprema Corte de Justicia de la Nación hoy se somete a discusión y votación la Consulta Popular para enjuiciar a expresidentes de la República, que propone y promueve el presidente López Obrador, y por el otro lado en el Tribunal Electoral del Poder Judicial de la Federación se vota mañana viernes si se da o no la razón a los nuevos partidos políticos a los que el INE les negó el registro, en particular el de Margarita Zavala y Felipe Calderón.
En el primer caso, la decisión que tomará la Corte sobre si la consulta solicitada por el Senado de la República a petición del presidente, definirá si ese ejercicio es o no constitucional y si la pregunta con la que se pretende consultar a los mexicanos se apega también a la Carta Magna. El sentido del voto mayoritario de los ministros será un buen referente para conocer qué tanto grado de autonomía mantiene aún el Poder Judicial con respecto del Poder Ejecutivo, pues un sector importante de los juristas y especialistas en derecho constitucional consideran que un ejercicio de consulta para enjuiciar a los expresidentes de la República no sólo es innecesario desde el punto de vista jurídico, porque se les podría enjuiciar sin consulta, sino que además plantea una violación a las garantías individuales de los exmandatarios.
Si la mayoría de los ministros decide declarar constitucional la Consulta y la pregunta de López Obrador, estarán validando y apoyando una maniobra que, más que jurídica o constitucional es política y que tiene un cálculo eminentemente político y electoral, puesto que sin ninguna duda la mayoría de la población se pronuncia a favor de que se enjuicie a cualquier político, pero especialmente a los expresidentes de la República, figuras hasta ahora intocables y que, en el imaginario colectivo simbolizan la máxima representación del abuso de poder y la corrupción que hemos padecido históricamente los mexicanos.
Para decirlo claramente: si la Corte le da por mayoría luz verde a la Consulta Popular para enjuiciar a los expresidentes, estarían mandando una señal de respaldo al presidente y a su política de maniobras y ocurrencias políticas con las que busca mantener el apoyo y la simpatía popular. Un voto mayoritario de los ministros en ese sentido, sería un guiño al inquilino de Palacio Nacional, quien además ha estado mandando mensajes de presión a la Corte, diciendo que tienen “que votar en conciencia” y que si rechazan la Consulta “ellos tendrán que asumir las consecuencias”.
Por otro lado, declarar inconstitucional el ejercicio que propone el presidente mandaría una señal de que aún con la influencia innegable que ha logrado con los ministros que ha propuesto y que han sido electos por el Senado y con la cercanía y simpatía que ha mostrado el actual ministro presidente Arturo Zaldívar hacia el proyecto de la 4T, López Obrador no tiene el control total del Poder Judicial y la Corte y sus demás instancias, aún representan un contrapeso real para un Ejecutivo cada vez más empoderado y con actitudes de avasallamiento al resto de los poderes y contrapesos autónomos del sistema político mexicano. De ese tamaño es la decisión que hoy tomarán los ministros y que nos permitirá saber si le queda aún algo de autonomía al Poder Judicial.
En el caso de los magistrados electorales, entre los asuntos que se definen en su sesión privada de mañana están las impugnaciones presentadas por el partido México Libre en contra de la decisión del INE de negarle el registro por presuntos financiamientos no identificados. La votación de los siete magistrados determinará si la corriente política de oposición al actual gobierno, que encabezan el ex presidente Felipe Calderón y su esposa Margarita Zavala podrá o no obtener el registro oficial para participar en las elecciones parlamentarias de 2021.
Para nadie es secreto y tampoco para los ministros la enorme rivalidad política existente entre el matrimonio Calderón y López Obrador, el cual quedó plenamente manifiesto en los comentarios de burla y sarcasmo que utilizó el presidente para referirse a la negativa del registro que dio el INE a México Libre. Hoy será interesante ver en qué sentido votan los magistrados electorales y con qué argumentos rechazan o validan la constitución del partido político del calderonismo y si el mayor adversario político del actual gobierno podrá o no estar en las boletas electorales del 2021.
Durante décadas, sobre todo en el viejo régimen priista, el Poder Judicial de la Federación estuvo sometido y subyugado a los designios de los presidentes en turno; la cosa no cambió mucho en los dos sexenios del PAN, aunque los ministros y la Corte adquirieron tanta relevancia en la vida pública en los últimos años, que por momentos se permitieron hacer sentir su fuerza e independencia como un poder real del Estado mexicano. Hoy en la 4T no queda claro todavía si el presidente López Obrador ha logrado, como lo ha hecho ya con muchos de los poderes autónomos, someter y controlar a la Suprema Corte o si los ministros reivindican con hechos, y no solo con discursos, su independencia. Y la votación de este jueves será un buen referente para saber la respuesta a esa incógnita.

NOTAS INDISCRETAS…
De todo lo que dijo ayer el canciller Marcelo Ebrard en la conferencia mañanera, sobre el caso del nombramiento ilegal de la embajadora Luz Elena Baños como embajadora eminente, la mayor parte son mentiras. El canciller afirmó que el nombramiento “nunca se le notificó” a la diplomática. Y en esta columna publicamos desde el pasado 19 de septiembre, el oficio DSE/DG/0327/2020 de la Secretaría de Relaciones Exteriores, fechado el 28 de agosto pasado, en el que claramente le informan a Luz Elena Baños Rivas, representante de México ante la OEA que “se le otorga el nombramiento como Embajadora Eminente, con efectos retroactivos al 10 de julio de 2020”. En el oficio, del que esta columna tiene copia, y que firma Moisés Poblano, director General del Servicio Exterior y Recursos Humanos de la cancillería, se dice textual que “por acuerdo del Presidente de la República y de conformidad con lo establecido en los artículos 24 de la Ley del Servicio Exterior Mexicano y el 133 del Reglamento de la Ley del Servicio Exterior Mexicano” se le concedió ese nombramiento por el cual incluso la felicita en el mismo oficio el funcionario que la notifica oficialmente. Luego el canciller dijo que “no se suspendió” ese nombramiento, y también en la misma fecha publicamos el correo electrónico, del cual también tenemos copia, en el que la misma Dirección del Servicio Exterior Mexicano y Recursos Humanos, les pide a diversas áreas de la SRE que suspendan los efectos del mencionado oficio DSE/DG/0327/2020. El correo dice textual: “PARA CONOCIMIENTO// COPIA PARA CONOCIMIENTO DEL OFICIO DSE/DG/0327/2020: “Se agradecerá hacer caso omiso de esta comunicación y suspender los efectos conducentes del oficio enviado”. Y entonces canciller, ¿cómo que no se suspendió ni se notificó el nombramiento ilegal de la embajadora Baños? Porque al final eso es lo más delicado de lo que ayer dijo el canciller enfrente del presidente: que el nombramiento de Luz Elena Baños, que no cumple con la Ley del SEM que en su artículo 22 establece que sólo podrán recibir ese nombramiento “aquellas personas que tengan una antigüedad mínima de 10 años como embajadores”. Y la diplomática Baños fue nombrada embajadora en 2018, aun cuando tenga, como dijo Marcelo, 48 años de trayectoria en el Servicio Exterior Mexicano y de que sea mujer y se quiera impulsar a más mujeres a esos cargos por un asunto de equidad de género que invocó el funcionario. Todo eso está muy bien, pero mientras las leyes no cambien o no se modifiquen, al canciller, por muy poderoso que sea en este gobierno, solo le quedan dos formas de validar un nombramiento ilegal como el que le hizo firmar al presidente: o manda una iniciativa para cambiar la ley al Congreso o busca embajadoras mujeres, que las hay, con 10 años de antigüedad para darles el nombramiento de “eminente”. A Marcelo Ebrard le han dado muchas facultades en esta administración porque sin duda es un político capaz e inteligente, pero ni el presidente que tanta confianza le tiene, le puede dar la facultad de “interpretar la ley”, solo de respetarla… Si las cosas ya estaban candentes en Morena, por su complicado proceso de elección interna y sus aguerridas tribus y corrientes, ahora que el INE decidió que sólo 5 de 46 candidatos a la Presidencia del partido, y 13 de 54 aspirantes a la Secretaría General van a ser encuestados para determinar quién de ellos llega a cada una de las posiciones, la cosa morenista se pondrá peor. Y es que la decisión de los consejeros electorales, que partió del criterio de que sólo debían participar en la elección los que resultaron mejor posicionados en la encuesta de conocimiento previa que mandó a hacer el INE, no le va a gustar a muchos de los que fueron eliminados, entre los que se encuentran dos aspirantes muy mediáticos como Gibrán Ramírez y Antonio Attolini, aspirantes a la presidencia y la secretaría general respectivamente. Según el criterio del INE, que atendió también las opiniones de las tres encuestadoras que van a levantar la encuesta nacional para elegir a los dirigentes, solo 5 aspirantes serán encuestados para presidente: Porfirio Muñoz Ledo, Mario Delgado, Yeidckol Polevnsky, Adriana Menéndez e Hilda Mirna Díaz Caballero. Para la secretaría general, son 13 los candidatos que aparecerán en la encuesta 9 mujeres y 4 hombres, entre los que destacan Citlalli Hernández, Karla Díaz, Paola Gutiérrez, Blanca Jiménez, Emilio Ulloa, Francisco Aurioles, entre otros. Lo dicho, en Morena ya había muchos problemas. Hoy se vienen más…Los dados mandan Serpiente. Caída libre.
",
"
JUAN FRANCISCO EALY ORTIZ
Estimadas colaboradoras y colaboradores de EL UNIVERSAL: 
Nuestro periódico, nuestra empresa multimedia, cumple hoy 104 años de vida, más de un siglo de registrar la historia moderna de México y el mundo. Desde luego, es un motivo de celebración, porque este logro ha sido posible gracias al esfuerzo de todos, al empeño de cada uno de los integrantes de esta casa editorial y también por la fidelidad de nuestros lectores, quienes reconocen en esta institución una guía confiable de información. 
Hoy tenemos más audiencia que nunca antes en nuestra historia, en gran medida por la expansión de las plataformas digitales, pero sobre todo porque, sin importar en dónde nos lean, dónde nos escuchen o dónde nos vean, la noticia que producimos en EL UNIVERSAL es siempre certera, veraz y oportuna; es confiable y eso lo avalan estudios y análisis de compañías externas dedicadas a la medición y opinión de las audiencias.
Sin embargo, tenemos que admitir que el éxito de nuestro alcance —en la sociedad mexicana e incluso más allá de las fronteras del país— no puede ser motivo para relajar el paso ni para confiarnos de la posición que hemos alcanzado. 
El esfuerzo, el empuje y el entusiasmo deben ser nuestros motores de todos los días.
También lee: Las horas de un mundo extraño
Por un lado, hoy está el desafío económico. La pandemia por coronavirus hizo que el actual fuera uno de los peores años en la historia del último siglo en cuanto a desempeño de la economía mexicana. Nuestra empresa no está exenta de esta situación difícil. Sacrificios han debido hacerse para continuar nuestra operación regular y seguir ofreciendo a nuestros lectores la mejor información las 24 horas del día, los 365 días del año. 
Durante uno de los recorridos por las instalaciones del diario, el Licenciado Ealy Ortiz prueba un linotipo.
A la complicada situación económica hay que agregar otro desafío: el político. Al poder nunca le ha gustado que se le cuestione, que se le critique. Yo lo sé, porque lo he vivido en los casi 51 años que llevo al frente de LOS UNIVERSALES. No gustaba a los gobiernos anteriores que publicáramos los artículos de Heberto Castillo, quien enviaba desde la prisión de Lecumberri sus colaboraciones a nuestra redacción. No les pareció bien que abriéramos la puerta a Manuel Clouthier ni a Cuauhtémoc Cárdenas. Reclamaban los duros textos de Rosario Ibarra de Piedra y de Lydia Cacho. Nunca les agradaron los cartones del finado maestro Naranjo ni del maestro Helio Flores, quien por cierto es una leyenda viviente en el mundo del periodismo.
Ahora no les gusta que publiquemos a Carlos Loret de Mola, a Jean Meyer, a Héctor de Mauleón, a Ana Paula Ordorica, a Sabina Berman y a tantas y tantos otros colaboradores críticos de las políticas de gobierno.
No les gusta, pero lo seguiremos haciendo, ese es nuestro papel y no el de aplaudir a los gobernantes en turno. Porque un sexenio no cambiará la vocación de pluralidad política que ha caracterizado a este periódico desde hace más de 50 años, cuando asumí su conducción.
Son otros tiempos. El Presidente de la República ya no puede decidir qué medios de comunicación se abren o se cierran, como intentaron hacerlo con EL UNIVERSAL en 1996 cuando fui encarcelado de manera arbitraria, simplemente por ejercer el derecho a la libre expresión, un valor de la democracia que ganamos, que defendemos y que defenderemos todo el tiempo.
Es la gente, el pueblo, quien determina qué medios de comunicación permanecen y cuáles cierran. El propio presidente Andrés Manuel López Obrador lo ha señalado: la ciudadanía es sabia, es lista, sabe distinguir cuándo la engañan y cuándo no. Las personas eligen dónde informarse. Ya no existe el monopolio de la información. 
Hace 51 años el Licenciado Juan Francisco Ealy Ortiz asumió la dirección de El Gran Diario de México. 
Por fortuna vivimos en una democracia en la que incluso un opositor de toda la vida como lo fue Andrés Manuel López Obrador puede llegar a ser Presidente de la República. Y lo es, en gran medida, gracias no sólo a la comunicación interpersonal en internet, sino a que los medios de comunicación exhibieron los errores, los excesos y la corrupción de los gobiernos anteriores, con notas, reportajes y opiniones. Sin importar el color del partido en el poder, eso no debe cambiar. 
También lee: El UNIVERSAL, el sitio de noticias más leído de México
Ahora nos encontramos en un momento histórico en el que el poder político cuestiona la veracidad misma de las noticias, a pesar de que existan evidencias detrás de los hechos presentados. Estudiosos de la comunicación en el mundo han llamado a esta etapa la era de la postverdad, en la que el periodismo es atacado desde los gobiernos para poner en duda su objetividad, para utilizar la investidura presidencial para agredir y estigmatizar al periodismo y a los periodistas. 
El campeón de esta estrategia es el presidente de Estados Unidos, Donald Trump, una táctica que ha resultado redituable para él y para otros actores en el mundo, quienes se aprovechan de que ahora, gracias a internet, los usuarios pueden leer y escuchar las versiones de la realidad que se ajustan a lo que cada quien decide creer.
Pero los medios de comunicación profesionales debemos combatir esa noción popularizada de que existen “verdades alternativas”, de que existen hechos diferentes a los que se presentan, de que existen otros datos oficiales, y lo debemos hacer con evidencias y con datos duros.
La mejor forma de hacerlo, de mantener nuestro estatus como instituciones confiables de información para la sociedad, es fortalecer el rigor en el trabajo diario y no dejar que la competencia nos haga caer en la tentación de reproducir lo que los poderosos quieren escuchar.
Queremos, como mexicanos que somos, ver realizado ese discurso de justicia social con el que el actual Presidente de la República llegó al poder, pero sabemos que eso no se conseguirá aplaudiendo las decisiones del gobernante, sino vigilándolo para señalar sus errores, con la esperanza de que la ciudadanía decida por cuenta propia. 
La preferencia de los lectores es gracias al esfuerzo de todos, afirma el Licenciado Ealy Ortiz. 
 Y en ese camino, es preciso dejar claro que EL UNIVERSAL no es un actor político, un adversario radical, es una empresa dedicada a hacer periodismo, a registrar la historia de México y el mundo, como lo ha hecho desde hace 104 años.
Ese es nuestro compromiso con México. Continuaremos nuestro papel como garantes de la información veraz, objetiva, plural y oportuna, sin importar el color del partido en el poder ni los ataques que recibamos por ejercer nuestra libertad.
También lee: Ealy Ortiz: con intolerancia han hecho creer que es un delito decir la verdad
Queridos colaboradores, lo he dicho antes y lo sostengo ahora: México es más grande que sus problemas, México es más grande que sus gobernantes, y esa grandeza es la que EL UNIVERSAL seguirá registrando con profesionalismo y con el compromiso solidario con la sociedad y la democracia mexicana. 
Muchas gracias y muchas felicidades a todos por estos 104 años de vida, que ahora celebramos a la distancia, una distancia impuesta por las actuales circunstancias. 
",
"

Arturo Herrera, secretario de Hacienda miraba al frente, entrelazaba los dedos, sabía que sería una comparecencia larga ante el pleno de la Cámara de Diputados. La oposición reclamaba por las fallas económicas de esta administración, pero principalmente por la desaparición de 109 fideicomisos que le dejarán al gobierno más de 68 mil millones de pesos.

Fue día de glosa del 2o. Informe de Gobierno. El funcionario, sentado en una curul, protegido por un panel de acrílico, miraba al pleno de San Lázaro. Preveía una larga sesión de más de seis horas y pidió refuerzos.

Uno de los aliados de la Cuarta Transformación, el coordinador del PT Reginaldo Sandoval, usaba la máxima tribuna del país para decir que este partido es la locomotora y va a la vanguardia ideológica de la 4T. En eso, detrás de Herrera, uno de sus colaboradores le acercó un recipiente y le llevó un pastelillo de chocolate.
 También lee: Gobernadores salientes dejarán deuda de 29 mmdp: Arturo Herrera

Parecía que era lo único que esperaba Herrera. Inmediatamente atacó. Con los dedos índice, medio y pulgar de su mano derecha tomó el pastelillo y le pegó una enorme mordida y su rostro se iluminó de felicidad.

Herrera endulzaba su paladar ante la lluvia de críticas de la oposición por el manejo de la economía, la falta de crecimiento e inversión, por la gestión durante la pandemia y porque sustente sus esperanzas de salir de la crisis a tener una vacuna. Segundos después el encargado de las finanzas asestó otra mordida al pastelillo.

Mientras tanto, la oposición arremetió contra Herrera.
 También lee: Herrera se endulza en comparecencia ante reclamos por extinción de fideicomisos

“Ahora se pretende, con el argumento de la emergencia sanitaria, cancelar los fideicomisos. Creemos que se puede combatir la corrupción sin extinguirlos, porque traerá consecuencias graves a diversos sectores”, aseguró Tonatiuh Bravo, líder de MC.

“La estrategia económica no ha funcionado. Las finanzas públicas están en una situación crítica, sin fondos de estabilización, con menos ingreso y más gasto que no apuesta por un enfoque productivo para el país”, lanzó el priista Ismael Hernández Deras.

El panista José Isabel Trejo criticó la meta de crecimiento de 4.6% y dijo que la crisis del Covid ha dejado desempleo y casi 80 mil muertos, mientras sus compañeros extendieron una manta.
 También lee: Hacienda anuncia el primer pago para compra de vacunas contra Covid-19

Los reclamos siguieron, firmes, fuertes y constantes. Herrera siguió comiendo su pastelillo.
",
"
Los patógenos que se encuentran en los tejidos que rodean a los dientes contribuyen a generar un tipo de cáncer oral muy agresivo, según un estudio de la Universidad de California, San Francisco, publicado este jueves en PLOS Pathogens. 
El estudio también demostró que este cáncer promovido por patógenos se inhibe con una bacteriocina, un péptido antimicrobiano y probiótico producido por bacterias.
El carcinoma de células escamosas de la cabeza y el cuello (HNSCC) es uno de los cánceres más comunes en todo el mundo, y dentro de este grupo, el carcinoma de células escamosas oral (CCEO) constituye el 90 por ciento de las patologías malignas orales, cuya tasa de supervivencia de cinco años no ha variado en décadas. 
Sin embargo, los factores de riesgo, como el tabaquismo, el consumo de alcohol y la infección por el virus del papiloma humano, por sí solos no explican ni la incidencia ni la naturaleza agresiva de este cáncer. 
Otros factores, como los patógenos de la boca, podrían desempeñar un papel importante en el desarrollo, la progresión y la metástasis de estos tumores, pero esto ha sido poco analizado. 
También lee: Vivir cerca de industrias aumenta el riesgo de padecer cáncer colorrectal
El estudio liderado por Yvonne Kapila, investigadora de la Universidad de California, comprobó si este tipo de cáncer oral está promovido por patógenos periodontales (es decir, los que afectan a las estructuras que rodean y sostienen los dientes).
Así, descubrieron que tres tipos de patógenos periodontales (Porphyromonas gingivalis, Treponema denticola y Fusobacterium nucleatum) mejoraban la migración celular del cáncer oral, la invasión y la formación de tumores en ratones.
Los científicos identificaron dos vías de señalización (integrina/FAK y TLR/MyDD88), unos procesos que se inhibieron con nisina, una bacteriocina y conservante de alimentos de uso común. 
También lee: Identifican al culpable de la malignidad del cáncer de cabeza
Según los autores, este estudio es la primera evidencia directa de que una bacteriocina inhibe la formación de cáncer oral mediada por patógenos periodontales. 
Además, los hallazgos sugieren que la nisina podría tener un amplio potencial terapéutico como agente antimicrobiano y anticanceroso, y como inhibidor de la formación de cáncer mediado por patógenos.
""Dado que un péptido de bacteriocina probiótica, la nisina, rescata esta carcinogénesis mediada por patógenos, estos hallazgos podrían hacer avanzar el tratamiento del cáncer oral y establecer un paradigma novedoso para el tratamiento del cáncer centrado en las terapias basadas en los antimicrobianos"", concluyen los autores del estudio. 
nrv
",
"
En sesión pública solemne, el Consejo General del Instituto Electoral de la Ciudad de México (IECM) tomó protesta a: Érika Estrada Ruiz, Sonia Pérez Pérez y César Ernesto Ramos Mega, como nuevos integrantes de ese organismo. 
Cabe destacar que la designación de estos nuevos consejeros ocurrió ayer, para ocupar el cargo durante los próximos siete años, por lo que este jueves rindieron protesta de manera presencial, en la sesión pública que se llevó a cabo de forma virtual.
Al darles la bienvenida, el presidente del IECM, Mario Velázquez Miranda, expresó su confianza en que los nuevos integrantes fortalecerán los trabajos de este Instituto, a través de la aportación de ideas y bajo los más altos estándares de calidad del Proceso Electoral Local Ordinario 2020-2021 que está en curso. 
Estrada Ruiz, por su parte, reconoció el trabajo del IECM a lo largo de los más de 20 años que tiene de existencia, en los cuales ha contribuido con logros significativos e innovadores a la vida democrática de la ciudad y del país en general. 
“Hace unas semanas empezó el Proceso Electoral en un ambiente que no es favorable, pues hay una preocupación en temas relevantes, como la situación económica, violencia, corrupción y emergencia sanitaria que vive todo el mundo, lo cual pone a prueba las capacidades de las autoridades, que debemos estar a la altura de corresponder la confianza depositada en nosotros”, dijo. 
A su vez, Ramos Mega precisó que su trabajo en el IECM se enfocará en atender cuatro temas fundamentales: la violencia política contra las mujeres en razón de género; el voto electrónico por internet; los mecanismos de participación ciudadana y la eficacia en el presupuesto del Instituto. 
En tanto, Pérez Pérez señaló que el trabajo de los servidores públicos se evalúa a través de resultados, por lo que su convicción está en obtener los mejores logros durante su desempeño en el IECM, cuya labor implicará la observancia de los principios rectores de la materia electoral, en beneficio de la ciudadanía. 
Mientras que los consejeros Carolina del Ángel Cruz, Mauricio Huesca Rodríguez y Bernardo Valle Monroy, también dieron la bienvenida a los tres nuevos integrantes del Consejo, de quienes reconocieron su experiencia y trayectoria en el buen desempeño de funciones a favor del fortalecimiento de la democracia del país. 
Por su parte, los representantes de los diferentes partidos políticos se sumaron a las felicitaciones y reconocimientos de los consejeras que llegan al IECM, en sustitución de Gabriela Williams Salazar, Myriam Alarcón Reyes y Yuri Gabriel Beltrán Miranda, tras concluir con su periodo de gestión este miércoles.
lr
",
