body,title
"
Cual vil mercado sobre ruedas, si no hay de una cosa habrá que llevarse otra. Así fue la convocatoria de Gerardo Martino después del anticlimático partido de anoche ante Guatemala. Negociada, demasiado negociada.
No hay una figura ejecutiva en la Femexfut para poner orden en esto; los intereses y caprichos están por encima de las ideas y la planeación. Miguel Herrera y Ricardo Ferretti, muy por encima de Gerardo Torrado, hicieron lo que se les pegó la gana y se quedaron con los futbolistas que quisieron, pese a que estaban programados para viajar hoy a Países Bajos.
No hubo liderazgo desde las oficinas del Centro de Alto Rendimiento, porque esto no se debe negociar con los equipos; ellos siempre querrán que sus futbolistas se queden, que no viajen, que no vayan a Selección. Eso es una realidad, es incómodo para quien les paga quedarse sin ellos cuando más los necesitan. Era desde las oficinas de la Liga a las de la Selección Nacional. Desde que se anunció que acudirían a Ámsterdam, quien sabe un mínimo de este deporte tendría que imaginar que el entrenador nacional no iba a querer llegar con un día de anticipación a Europa y jugar contra una potencia. Entonces, el viaje sería en plena Jornada 13, la que así planificaron en la Liga MX.
 

 

Reprogramar algunos partidos de los afectados hubiera sido lo correcto. Incluso, adelantarlos y que —en lugar de no ir a jugar contra Países Bajos y Argelia— que no lo hicieran ante Guatemala, rival que no sirvió para maldita la cosa. Pudieron haber jugador ayer, hoy y viajar sin problemas a Europa. Ahora, si era muy precipitado, entonces están abiertas las fechas de la final de Copa MX, porque el 21 de octubre y 4 de noviembre habría espacio. Es cuestión de voluntades, de trabajar por el bien del futbol mexicano y no dejar esta pésima imagen directiva, tanto de la dirección de Selecciones, como de la Liga MX. Insisto, los equipos siempre tratarán de negociar a su favor, y hacen bien.
Así, América, Chivas, Cruz Azul y Tigres lograron que algunos de sus futbolistas importantes se quedaran en México para jugar la Jornada 13 y viajaran después o de plano no hacer el traslado a Europa. Ahí están los casos de Henry Martín, delantero americanista que viajará el domingo. Otros ya no irán, como el caso de Carlos Salcedo de los Tigres, gracias a que el Tuca Ferretti exigió que no fuera a los Países Bajos.
Hasta ahora es cuando Martino tendrá un panorama más claro de cómo se trabaja en el entorno de la Selección Nacional, pero bajo los caprichos de los entrenadores y los clubes. Se le acabó la luna de miel al Tata, quien ya va conociendo a sus más grandes rivales de cara a la eliminatoria y que no tienen que ver con los que enfrentará en la cancha.
LEER MÁS: Sorpresas en la convocatoria de México para partidos en Holanda
",
"

Andrés Manuel López Obrador designó a Jorge Nuño, jefe de la Unidad de Inversiones de Hacienda, como el encargado de aprobar o desechar los proyectos de inversión en infraestructura que presentó el lunes en Palacio Nacional la Iniciativa Privada (IP). A pesar de que la participación del gobierno será mínima, el Presidente condicionó a los empresarios a que el plan se enfoque a los estados más rezagados económicamente y fue más allá: deben tener conexión con sus cuatro proyectos estrella y sus programas sociales.

Para hacer cuadrar los caprichos del Presidente con las propuestas de los empresarios, Jorge Nuño trabaja en el diseño del plan, que será de 200 mil millones de pesos en cerca de 100 proyectos, la mayoría de infraestructura carretera, portuaria, hidráulica, ferroviaria y algunas concesiones. Donde chocan con pared, tanto los empresarios como el propio jefe de Inversiones de Hacienda, es con el sector energético. La secretaria Rocío Nahle y el director de la CFE, Manuel Bartlett no sólo no quieren nueva inversión privada, si no que quieren echar a los que tienen contratos.

Los empresarios creen utópicamente que el plan de inversión por 100 mil millones de dólares que propusieron el año pasado al gobierno federal puede avanzar, pero la realidad es que el presidente es casi igual de radical que Nahle y Bartlett en cuanto a la participación de la iniciativa privada en el sector energético, por lo que difícilmente se podrán sacar nuevos proyectos. Al menos no los de gran calado.

Jorge Nuño trabaja en coordinación con la Secretaría de Comunicaciones y Transportes, de Energía, de Economía, del Bienestar y con el Coordinador General de Programas Integrales de Desarrollo para afinar el plan, todo con la última palabra que dará el presidente López Obrador a más tardar el fin de semana, para que sea anunciado el lunes en la conferencia matutina.

Esta fue la razón por la que el lunes, a su salida de Palacio Nacional, el presidente del Consejo Coordinador Empresarial, Carlos Salazar, y el del Consejo Mexicano de Negocios, Antonio del Valle, no pudieron dar información relevante a los medios de comunicación. Ambos desconocen cuáles serán los proyectos que aprobará el Ejecutivo. Y es que más allá de su viabilidad y posibilidad de reactivar más rápidamente la economía, se seleccionarán conforme a los intereses del Presidente.

Vale la pena analizar el perfil del hombre de confianza del presidente para hacerle cuadrar el plan de inversión privada. Jorge Nuño es un egresado del ITAM que trabajó en la Secretaría de Hacienda en el sexenio de Felipe Calderón. Fue el encargado de dirigir los proyectos de Hidrocarburos en la Unidad de Inversiones; previamente trabajó nueve años en la Secretaría de Energía, también durante el paso por esa dependencia del expresidente.

Entre sus logros, presume la instrumentación de la reforma energética de 2008 en materia de inversión. Con el gobierno de la 4T debe estar frustrado por la contrarreforma que planteó el presidente López Obrador y con la política energética de Rocío Nahle.

Tras su paso por la administración pública, fundó el despacho privado Alternativa Económica Consultores, del cual se ostenta como CEO. Junto con otro exfuncionario de Hacienda en el sexenio de Felipe Calderón, Héctor López Leal, se dedican a dar consultoría en proyectos y planes de inversión en los sectores público y privado.

Se podría alegar un conflicto de interés entre quien, por un lado, asesora a empresas en proyectos públicos y privados, y por el otro, aprueba o desecha los que propusieron empresarios al Presidente para reactivar la economía.

Pero en la 4T todo es posible, y lo que no, se niega y se le da vuelta en la mañanera.

[email protected]:@MarioMal
",
"
Después de vencer a Julio César Chávez Jr., Mario Cázares no afloja su intención de enfrentar a Saúl “Canelo” Álvarez. 
El sinaloense (12-0-0, 5 KOs) repitió su deseo de pelear ante el tapatío, además de asegurar que su propuesta ya la tiene el equipo del múltiple campeón mexicano.
""Puedo pelear en el peso que él quiera. Las condiciones están dadas para que esa pelea se dé. Estoy seguro, mi nombre está sobre la mesa para DAZN, no veo ninguna complicación para que esa pelea se dé”, dijo Cázares en teleconferencia. 
Y repitió: “La gente  quiere que le tumben todas las pecas”. 
Cázares, de 30 años de edad, derrotó el pasado viernes –por decisión unánime– al Hijo de la Leyenda en una cartelera a puerta cerrada en Tijuana. Después del resultado, el sinaloense reveló que su celular no deja de sonar, para ofrecerle otros combates, pero el quiere medirse con Álvarez. 
 

 

“Canelo es el siguiente. Sobre la mesa está la oferta, no es una obsesión”. 
El pugilista subrayó el respeto que tiene por su compatriota, a pesar de que no lo considera en la élite del deporte.  “Es un buen boxeador, con mucho talento y habilidades… pero no es un fuera de serie”. 
Álvarez se encuentra en una posición delicada en el tema lega, ya que tiene un proceso dentro de una Corte en California, en contra de Oscar de la Hoya, Golden Boy Promotions y DAZN por incumplimiento de contrato. El tapatío quiere función este año, pero la pandemia de Covid-19 ha frenado su agenda, una situación que Cázares quiere aprovechar.
LEER MÁS: ¿Cuánta gente podría ir a los estadios en la Liga MX?
",
