body,title
"

Cuando estábamos por revelar los videos del hermano del presidente López Obrador recibiendo paquetes de dinero en efectivo, dediqué un rato a pensar en cómo reaccionaría el primer mandatario mexicano. Cuál podría ser la contestación de un hombre que ha construido su carrera política a base de decir que él no es corrupto. Qué movimiento político podría realizar tras ver a su hermano Pío recibiendo dinero ilegal, diciendo que era para la campaña presidencial del 2018 y que Andrés Manuel sabía todo.

Deduje que los videos de Pío le ofrecían al presidente la enorme oportunidad de demostrar que su lucha contra la corrupción era real y legítima. Sacudirse las sospechas de que se concentra mucho en atacar a los corruptos del pasado y deja en la impunidad a los corruptos del presente. Los escándalos que se han acumulado en su sexenio, las sospechas sobre financiamiento ilegal a su propia campaña, podrían lavarse si Andrés Manuel era implacable con Pío.

Imaginé entonces que a la mañana siguiente a la divulgación de los videos de su hermano recibiendo dinero, el presidente López Obrador –en uno de esos gestos histriónicos que tanto le gustan– caminaría hasta la Fiscalía General de la República seguido de todos los reporteros que cubren sus actividades diariamente. Que llegaría hasta ahí para presentar una denuncia en contra de su hermano y exigir al fiscal Gertz Manero –que ha resultado muy eficaz para seguir las sugerencias del presidente– que citara de inmediato a Pío López Obrador y a quien hasta ese momento era un funcionario estrella del gobierno federal, David León, protagonista también de los videos. Y al día siguiente, los dos rindiendo su declaración.

Era una manera de sacudirse el lodo. Pero nada de esto sucedió. El presidente optó por permitir que el lodo del pantano manchara su plumaje… otra vez.

El jueves 20 de agosto revelamos en Latinus los videos de Pío López Obrador y David León con los paquetes de dinero. El viernes 21 en la mañanera el presidente justificó y exoneró a su hermano. Dijo que el efectivo era fruto de “aportaciones del pueblo al movimiento” (la frase sigue siendo fuente de inspiración para las más ácidas burlas) y prometió que para transparentar todo, se presentarían a declarar ante la Fiscalía los involucrados.

Ayer se cumplieron 40 días de esa promesa. La cuarentena de Pío. No ha sucedido tal declaración. De hecho, Pío López Obrador no ha emitido sonido alguno sobre el escandaloso asunto. No necesita. Su hermano lo protege. Impunidad garantizada.

¿Será que una mujer que se convirtió en alta funcionaria financiera del gobierno federal es protagonista estelar de otro de los videos de la misma saga?

[email protected]
",
"
Berlín.- El opositor ruso Alexéi Navalni acusó al presidente Vladimir Putin de estar ""detrás"" de su envenenamiento y garantizó que volverá a Rusia en cuanto esté totalmente recuperado, en su primera entrevista publicada tras salir del hospital alemán donde fue tratado.
""Afirmo que Putin está detrás de este acto, no veo otra explicación"", declaró al semanario alemán Der Spiegel, que publicó este jueves la entrevista en su página en internet.
Sus acusaciones coinciden con una cumbre en Bruselas, en la que se podría debatir sobre la respuesta de la Unión Europea (UE) a Rusia por este asunto.
Alemania ostenta la presidencia de la UE este semestre y ha amenazado a Moscú con sanciones. La canciller Angela Merkel fue personalmente a visitar a Alexei Navalni al hospital en el que estaba internado.
""Mi deber ahora es seguir siendo el que soy, alguien que no tiene miedo. ¡Y no tengo miedo!, afirmó el principal opositor al Kremlin en su entrevista.
Navalni confirmó también su intención de volver a Rusia en cuanto esté totalmente recuperado.
""No voy a hacer a Putin el regalo de no volver a Rusia"", dijo, explicando que desea recuperarse ""lo más rápido posible"" para regresar. ""No volver significaría que Putin ha logrado su objetivo"", agregó.
El Kremlin reaccionó inmediatamente. Su portavoz negó las acusaciones de Navalni y consideró que servicios de inteligencia occidentales como la CIA ""trabajan"" con el opositor ruso.
""Consideramos estas acusaciones contra el presidente ruso sin fundamento e inaceptables"", declaró Dmitri Peskov. 
Según el portavoz, las agencias de inteligencia occidentales, ""concretamente instructores de la CIA trabajan en este momento"" con el líder opositor.
Según Peskov, ""cualquier ciudadano ruso puede volver al país cuando quiera y no hay nada de heroico en ello"".
Incansable activista de la lucha contra la corrupción, Navalni, de 44 años, se sintió mal repentinamente a bordo de un avión en Siberia el 20 de agosto.
Tres laboratorios europeos afirmaron que había sido víctima de un envenenamiento con una sustancia neurotóxica de tipo Novichok, creada en la época soviética con fines militares.
Según los allegados de Navalni, se encontraron restos de Novichok en una botella de agua recogida en su habitación de hotel en Siberia, donde estaba en campaña para apoyar a los candidatos a unas elecciones locales.
En su entrevista con Der Spiegel, Navalni recordó el momento en que se sintió mal a bordo del avión que sobrevolaba Siberia con destino a Moscú.
El líder opositor afirmó que dijo a la tripulación que había sido envenenado. ""Oí voces cada vez más lejanas y una mujer que decía: 'No se desmaye'. Y eso es todo, sabía que me moría. Luego me di cuenta de que me había equivocado"", narró.
En una publicación reciente en su cuenta en la red social Instagram, Navalni agradeció a los pilotos de avión que realizaron un aterrizaje de emergencia en Omsk, en Siberia, porque le salvaron la vida.
""El plan de los asesinos era sencillo: que me sintiera mal 20 minutos después del despegue, que perdiera el conocimiento 15 minutos después y (...) que una hora más tarde terminara en una bolsa de plástico negra"", dijo.
Varios países occidentales pidieron a Rusia una investigación del caso. Moscú ha rechazado hasta ahora todas las acusaciones y cualquier vinculación con el presunto envenenamiento.
Este jueves, el presidente de la Duma, la cámara baja del Parlamento ruso, acusó a Navalni de trabajar para los servicios secretos occidentales y aseguró que Putin le había ""salvado"" la vida.
""Navalni no tiene vergüenza, es un canalla. Putin le salvó la vida (..) Está claro que Navalni trabaja para los servicios especiales y las autoridades de los países occidentales"", dijo Viatsheslav Volodin.
Navalni salió del hospital berlinés de la Charité hace una semana después de haber permanecido internado un mes y sigue su convalecencia en Alemania.
El opositor anunció en su cuenta en Instagram que tenía por delante una larga rehabilitación para ""poder sostenerse sobre una pierna y recuperar totalmente el control de los dedos"".
Recientemente, el Kremlin aseguró que era libre de volver a Rusia. Pero paralelamente, ujieres rusos congelaron cuentas y confiscaron la parte del apartamento que posee el opositor en Moscú, mientras estaba en coma en Alemania.
Según su portavoz, estas decisiones judiciales están vinculadas a un litigio entre Evgueni Prigojin, un empresario considerado cercano al Kremlin, Navalni y una de sus aliadas, Liubov Sobol.
agv
",
"
El 24 de octubre de 1916, 23 días después de su fundación, EL UNIVERSAL lanzó una edición especial que salió a la venta a las diez de la noche.
Esa edición anunció el “destape” de Venustiano Carranza como candidato a la Presidencia de la República.
El director y fundador del periódico, Félix Fulgencio Palavicini, había estado en la reunión en la que esta decisión fue tomada. No quiso esperar al día siguiente para dar a conocer la noticia: regresó al periódico, y escribió o dictó lo que había visto y escuchado, y entregó las cuartillas al jefe de información.
Sacar una edición a aquellas horas era, según el diario, una riesgosa “aventura informativa”.
La nota de Palavicini informaba que los generales que pisaban más fuerte dentro del Constitucionalismo se habían reunido en la calle de Gelati, en Tacubaya, donde vivía el general Pablo González, para postular al Primer Jefe como candidato a la presidencia.
“El general Pablo González tomó la palabra y dijo a los concurrentes que el objeto de la asamblea era que se unificase el criterio del elemento revolucionario y que se formase un gran partido político que, contando con los más conspicuos elementos de la revolución, postulase para Presidente de la República, en el próximo periodo constitucional, al C. Don Venustiano Carranza”.
La edición –30 centavos el ejemplar– fue vendida en los cines, los bares, los teatros, las cantinas, las avenidas principales de la ciudad. La redacción de EL UNIVERSAL estaba entonces en Madero y Motolinia. En el mismo edificio que se conserva hasta la fecha, y en el que había funcionado el famoso restaurante Gambrinus –donde Victoriano Huerta aprehendió a Gustavo Madero, al que envió a la Ciudadela para que fuera linchado por una soldadesca ebria de tequila, marihuana y odio.
Unos meses más tarde, Palavicini obtuvo una de las grandes primicias del periodismo en México: en un suplemento de cuatro páginas publicó la Constitución que sería promulgada el 5 de febrero de ese año. Se tiraron 50 mil ejemplares. A las diez de la mañana no quedaba un solo ejemplar: se mandó tirar una edición extraordinaria: los nuevos ejemplares fueron pegados en los muros de las esquinas más concurridas del centro.
No existe en la tierra nada más efímero que el periodismo. Las noticias de la mañana son empleadas al día siguiente para limpiar vidrios o envolver filetes. Recuerdo que Ibargüengoitia relató la experiencia indescriptible de encontrar uno de sus artículos más brillantes como fondo de un bote de basura.
Llegué a la redacción de EL UNIVERSAL por primera vez una mañana de 1995, invitado por Ramón Márquez a escribir crónicas deportivas. Hallé una forma de la felicidad: cubría partidos del Atlante, el Cruz Azul, los Pumas, el Necaxa y el América; cubría funciones de box y de lucha libre. No comprendí, sin embargo, en dónde estaba parado, hasta el día en que llegué a la hemeroteca, en el cuarto piso del diario, buscando una noticia sobre el primer gran ídolo del boxeo mexicano: Rodolfo El Chango Casanova.
Hay momentos en que una vida se decide para siempre. En los anaqueles de la hemeroteca, empastados en keratol y concentrados en millones de páginas amarillentas, se hallaban unos 29 mil días de la vida de México.
Me envolvió la fascinación del tiempo. Tomé algún tomo al azar y cuántas cosas cayeron como flores muertas, que al abrir esas páginas volvieran a la vida cargadas de magia, de fuerza, de misterio. “Trotsky murió ayer a las 7:25 de la noche”.
Las horas volaron. Extraje tomos como un borracho incapaz de parar en la barra de una cantina. “Fidel Velázquez anuncia su retiro para 1962”. “Trágica muerte de Pedro Infante”. “Protestó el presidente Obregón”.
Recuerdo que emergí a la realidad cuando en Bucareli había oscurecido y yo me sentía como uno de esos arqueólogos que salen de una cueva en la que en mil años no hubiese entrado la luz.
Entendí a Borges: “Vi por mis ojos lo que nunca había visto”.
Desde aquel día comencé a cambiar citas, a ajustar horarios, a acortar o de plano a suprimir reuniones, a fin de tener a mi disposición algunas horas en las cuales frecuentar la hemeroteca.
Artículos de López Velarde, de Martín Luis Guzmán, de José Vasconcelos, de Efrén Rebolledo, de Federico Gamboa. Crónicas urbanas de Jacobo Dalevuelta; crónicas deportivas de Fray Nano; crónicas policiacas de José Pérez Moreno y El Güero Téllez.
Recorrí EL UNIVERSAL Ilustrado, el brazo cultural del periódico durante varias décadas, que dirigió la mano genial y erudita y alcohólica de Carlos Noriega Hope; descubrí los increíbles artículos de la primera cronista de la vida moderna, Cube Bonifant; me deslumbré con las entrevistas y los reportajes de Regino Hernández Llergo –una de los cuales le costó la vida a Francisco Villa.
Con la lista de los personajes que han escrito en este periódico se podría formar un directorio telefónico en el que desfilara la “inteligentsia” de México.
Alguna vez, el periódico fue censurado y dejó de aparecer durante 18 días. Otras veces sus directores fueron perseguidos, calumniados, encarcelados.
Han pasado caudillos, y sexenios, y gobiernos de todo tipo.
EL UNIVERSAL hoy cumple 104 años.
Las horas en que este diario ha registrado la vida de México, que son las horas de un mundo extraño, no tienen igual en el periodismo mexicano.
Larga vida a El Gran Diario de México.
",
"
Si bien no hay consenso respecto a quién ganó el debate presidencial, sí existe una opinión prácticamente unánime de que fue el peor de la historia, que en ningún momento se produjo alguna discusión sustantiva de ideas o estrategias y que, en última instancia, la gran perdedora fue la democracia de Estados Unidos.
Haciendo a un lado los insultos y la paja retórica que abundó en los intercambios entre Trump y Biden, destaca un gran foco rojo: la advertencia de Donald Trump de que no reconocerá los resultados electorales si una buena parte de la votación se realiza por correo. En las condiciones actuales de pandemia se anticipa que la emisión de votos por la vía postal sea mucho más elevada que en cualquier otra elección. A ese hecho, el todavía presidente de Estados Unidos lo comienza a calificar de fraude, seguramente como reacción a su caída en las preferencias electorales y en las encuestas. Se anticipa así a una derrota que desde ya comienza a calificar de ilegítima. Es lo único que le faltaba a los maltrechos Estados Unidos.
Los temas de suyo candentes que propuso el moderador, dan fe de un país fracturado en lo racial, en el manejo de la pandemia, en la forma de reabrir la economía y en la composición de la Suprema Corte de Justicia. A estos asuntos tan delicados habrá que sumarle ahora el del funcionamiento y la credibilidad de la democracia electoral. El escenario que se perfila es preocupante. Si Trump decide desconocer el resultado de las votaciones, Estados Unidos puede entrar en una etapa inédita de inestabilidad política, rompiendo con una larga tradición republicana en la que el derrotado reconoce al vencedor. Aun en las competidas y poco aseadas elecciones de 2000, donde se realizaron conteos a mano en Florida, Al Gore terminó dando por bueno el resultado a favor de George W. Bush. Ahora no existe la certeza de que vaya a suceder así. El único resultado aceptable para Trump es su victoria. Cualquier otro desenlace se convertirá en un llamado a sus bases para desconocer los comicios.
Esa postura explica por qué Trump se rehusó a condenar pública y abiertamente a los supremacistas blancos. Esas agrupaciones radicales le servirán como perros de presa para vulnerar sistemáticamente lo que sería una presidencia de Joe Biden. Las pugnas raciales, ya de por sí fuertes y persistentes en la actualidad, se agudizarán con el ingrediente político, con una porción importante de la población estadounidense rechazando la legitimidad de sus autoridades electas.
En realidad, la estrategia de Trump fue una suerte de ultimátum al pueblo norteamericano: o bien me reeligen o se desatará el caos y la ingobernabilidad. Así, aun en el escenario de una victoria aplastante de los demócratas, Donald Trump ya sembró la semilla de que la única forma de sacarlo de la Casa Blanca será poniendo en riesgo la democracia y la convivencia civilizada en EU.  

Internacionalista
",
"
El Presidente de la República asegura en su gobierno no hay corrupción, sin embargo, nos comentan que en meses pasados se tuvo que cambiar la manera en cómo se hacían las subastas en el Instituto para Devolver al Pueblo lo Robado. Nos explican que se tuvo que utilizar la modalidad de ofertas a paleta alzada en lugar de hacerlas en sobre cerrado, pues se había encontrado que funcionarios del organismo filtraban información a ciertos participantes, lo que garantizaba que obtuvieran los lotes deseados. Ahora, en la primera subasta que se realizará en la naciente gestión del nuevo titular del Instituto, Ernesto Prieto Ortega, el próximo día 9, se regresará a la mecánica inicial de sobre cerrado. El experimento debe de funcionar para que se borre la imagen que quedó tras la salida del exdirector de esta entidad que denunció irregularidades, como la de las joyas que fueron desvalijadas antes de subastarlas, y que a muchos dejó la impresión de que en lugar de ser el Instituto para Devolver al Pueblo lo Robado, se estaba convirtiendo en el Instituto para Robar al Pueblo lo Devuelto.

Scherer fuera de la pelea por Morena
En la Consejería Jurídica de la Presidencia se han amanecido con versiones de que hay intervención de esa oficina, que dirige Julio Scherer, en la contienda por la dirigencia nacional de Morena. Comentan que cuando la tensión aumenta y los momentos de crisis ponen a prueba la naturaleza humana, lo más simple es culpar a un tercero. Dicen que pareciera suceder que en la contienda Interna que vive Morena, de pronto y de un momento a otro, a tirios y troyanos se les ocurrió que el responsable de todos los males que podrían caer sobre el partido es el consejero jurídico. Aseguran que Scherer ni tiene candidato ni hace política de partido, pero lo que sí es verdad, comentan, es que los contendientes tendrían que revisar todo aquello a lo que su ambición los ha llevado y al mismo tiempo pensar que al que dañan es al presidente Andrés Manuel López Obrador. 

Gobernadores de AN contra extinción de fideicomisos
Un frente más se suma a las diferencias entre los gobernadores de Acción Nacional con la autollamada Cuarta Transformación. A los temas presupuestales, sanitarios y de seguridad, ahora se suma el de la iniciativa impulsada por los legisladores de Morena para la desaparición de 109 fideicomisos, entre los que se encuentran los apoyos que son requeridos de manera importante para hacer frente a contingencias para desastres naturales, así como a la ciencia y la tecnología. Los panistas mandatarios anunciaron su rechazo absoluto a esta iniciativa sosteniendo que es claramente irresponsable. Sin embargo, habrá que ver si además de su pronunciamiento, los gobernadores logran influir para que los legisladores panistas y del resto de la oposición frenen a Morena, que al menos en la Cámara de Diputados se ve venir como una locomotora en bajada. 

Sucesión en Morena seguirá en tribunales
Y para ahondar más en el conflicto interno de Morena, ahí vienen nuevamente impugnaciones por el resultado de la encuesta de reconocimiento encargada por el Instituto Nacional Electoral, y que deja fuera a varios que aspiraban a llegar a la dirigencia nacional del partido en el gobierno. Quien ya levantó la mano primero para que la situación de Morena siga en los tribunales, es Gibrán Ramírez, y de ahí las que se acumulen.
 



Irregularities at the INDEP 







",
"

“Las revoluciones fracasan cuando se entrega el poder al 'nuevo gobierno'""
R. Flores.

Morena no debería de ser tan importante para el futuro del país, pero, ni modo, así funciona la democracia.
Morena, guste o no, no se debe a Morena, se debe, en todo, al populismo del presidente López Obrador que fundó la institución por ser un requisito, un mero trámite para llegar al poder y hoy, una vez conquistado, sus militantes se quedaron huérfanos, algunos resentidos y otros embelesados de poder… Sí, de alguna forma, casi todos enfermos.
El “partido” ha demostrado ser, más bien, un carísimo cuchitril de tribus y corrientes que chocan entre sí y, a veces, también se tapan porquerías.
Nunca se investigó a fondo el blanqueo de dinero que Morena hizo con los recursos del fideicomiso para ayudar a las víctimas del sismo de 2017, ahí estaban los videos, ahí estaban las cuentas, ahí estaban los delitos, pero ¡carpetazo y chitón!
Tampoco prosperaron las decenas de denuncias de ventas de candidaturas, sin importar que varias de ellas tenían elementos legales para caminar en el tribunal, de pronto “algo” pasaba y los denunciantes terminaban por desistir, sí, igualito que en el pasado solo que mucho peor.
Morena es el caos, es el reflejo mexicanísimo de nuestra desorganización, del macho que impone por sus pistolas condiciones e ideas. Morena es autofágica, un mazacote canibalesco donde se mira lo peor de nosotros… Sí, de muchas formas, jodidamente por desgracia, Morena es México.
No han podido arreglar su elección y ahora el INE tendrá que decidir, mediante encuesta abierta, quién será su próximo presidente y secretario general, el caos en el que se encuentran lo tienen bien merecido por desorganizados, por no tener la humildad suficiente para aprender a ganar, por sus egos desbordados.
Empero, esta elección podría ser la tumba de Morena, por alguna afortunada razón han quedado fuera algunos de los aspirantes más radicales a presidir el partido y, evidentemente, no se quedarán con los brazos cruzados.
Protestas, cierre de calles, en una de esas y a alguno de los radicales se le ocurre tomar el INE, no descarte nada, esto se pondrá sabroso.
Ojalá que Porfirio Muñoz Ledo tenga razón y Mario Delgado, si gana, garantice realmente
la transición de Marcelo Ebrard como candidato presidencial, ojalá que, por el bien de todos, pronto tengamos autoridades más firmes, moderadas y menos ocurrentes, pero eso, entendiendo los caprichos de la 4T y el tesón imperial de López Obrador, suena, más bien, como una medida desesperada de Don Porfirio, historia andante, para atraer reflectores, un poco chocheante, un poco a atole con el dedo, un mucho como un distractor baratón.
¡Vamos! que nada, absolutamente nada está escrito.
Dudo que si gana Mario Delgado pueda institucionalizar lo salvaje, convertirse en el domador de lo indómito… Dudo que alguien pueda.
Quizá, para 2024 Morena ya no sea tan importante y los radicales hayan formado otros grupos, otros partidos.
Quizá, para 2024 Morena sea igual o más importante, pero llena de grupúsculos, de caciques regionales.
Como sea, apuesto que de ahí no saldrán héroes, al siguiente presidente solo le espera el desgaste.
De Colofón.- Veracruz se enfrenta a la SCJN: La mesa directiva del congreso local cumple dos meses en desacato al no restituir a dos magistrados del Tribunal Superior que ganaron amparos para recuperar su trabajo sin importar su edad.
La consecuencia, en breve, podría ser que los diputados locales, si les logran quitar el fuero, terminen en prisión.
¿De plano vamos a desconocer los fallos legales?, ¿todos contra todos?, ¿ley de la selva?

@LuisCardenasMX
",
